{"$schema":"https://json-schema.org/draft/2020-12/schema","$id":"espresso.val001.historical_reexpression.v2","type":"object","required":["schema_version","record_id","source_work_package","historical_commit","historical_tree","original_artifact_path","original_artifact_sha256","original_evidence_class","source_classification","calibration_relationship","result_known_status","original_disposition","claim_ceiling","protected","holdout","source_observations_reopened","analyzer_rerun","new_score_bearing_comparison","result_role","physical_validation"],"properties":{"schema_version":{"const":"espresso.val001.historical_reexpression.v2"},"record_id":{"type":"string","minLength":1},"source_work_package":{"type":"string","minLength":1},"historical_commit":{"type":"string","pattern":"[0-9a-f]{40}"},"historical_tree":{"type":"string","pattern":"[0-9a-f]{40}"},"original_artifact_path":{"type":"string","minLength":1},"original_artifact_sha256":{"type":"string","pattern":"[0-9a-f]{64}"},"original_evidence_class":{"type":"string","minLength":1},"source_classification":{"enum":["PUBLIC_SOURCE_LINKED","SYNTHETIC_NONPROTECTED","PUBLIC_EQUATION_REFERENCE"]},"calibration_relationship":{"type":"string","minLength":1},"result_known_status":{"const":"KNOWN_BEFORE_VAL001"},"original_disposition":{"type":"string","minLength":1},"claim_ceiling":{"type":"string","minLength":1},"protected":{"const":false},"holdout":{"const":false},"source_observations_reopened":{"const":false},"analyzer_rerun":{"const":false},"new_score_bearing_comparison":{"const":false},"result_role":{"const":"HISTORICAL_GOVERNED_RESULT_REEXPRESSION"},"physical_validation":{"const":"NOT_ESTABLISHED"}},"additionalProperties":false}
