{"schema_version":"espresso.val001.historical_reexpression.v2","record_id":"WP_0_3B_LIANG_VERIFICATION","source_work_package":"WP-0.3B","historical_commit":"a0c556cf42e3d0ce7e8a5a370e8082547544d836","historical_tree":"1b35766105510a3b8b32b828225e54fbed1d1169","original_artifact_path":"validation/results/WP_0_3B_A1_NONPROTECTED_EXTRACTION_VERIFICATION_RESULT.json","original_artifact_sha256":"8af2ec832b191f96994f762eca85eacdc9bfa68ef316321b6b56894d649b6349","original_evidence_class":"SYNTHETIC_IDENTIFIABILITY_AND_MEASUREMENT_KERNEL_VERIFICATION","source_classification":"SYNTHETIC_NONPROTECTED","calibration_relationship":"SYNTHETIC_ONLY","result_known_status":"KNOWN_BEFORE_VAL001","original_disposition":"PASS_NUMERICAL_VERIFICATION","claim_ceiling":"NO_STRUCTURAL_IDENTIFIABILITY_OR_EXPERIMENTAL_VALIDATION","protected":false,"holdout":false,"source_observations_reopened":false,"analyzer_rerun":false,"new_score_bearing_comparison":false,"result_role":"HISTORICAL_GOVERNED_RESULT_REEXPRESSION","physical_validation":"NOT_ESTABLISHED"}
